{
  "$id": "research-references.v1.schema.json",
  "$schema": "https://json-schema.org/draft/2020-12/schema",
  "additionalProperties": {},
  "properties": {
    "kind": {
      "const": "ResearchReferences",
      "type": "string"
    },
    "mode": {
      "enum": [
        "full",
        "reference-only"
      ],
      "type": "string"
    },
    "references": {
      "items": {
        "additionalProperties": {},
        "properties": {
          "capture": {
            "oneOf": [
              {
                "additionalProperties": {},
                "properties": {
                  "kind": {
                    "const": "manual",
                    "type": "string"
                  }
                },
                "required": [
                  "kind"
                ],
                "type": "object"
              },
              {
                "additionalProperties": {},
                "properties": {
                  "content": {
                    "additionalProperties": {},
                    "properties": {
                      "bytes": {
                        "maximum": 9007199254740991,
                        "minimum": 0,
                        "type": "integer"
                      },
                      "mediaType": {
                        "minLength": 1,
                        "type": "string"
                      },
                      "path": {
                        "maxLength": 512,
                        "type": "string"
                      },
                      "sha256": {
                        "pattern": "^[0-9a-f]{64}$",
                        "type": "string"
                      },
                      "trust": {
                        "const": "untrusted",
                        "type": "string"
                      }
                    },
                    "required": [
                      "path",
                      "sha256",
                      "mediaType",
                      "bytes",
                      "trust"
                    ],
                    "type": "object"
                  },
                  "fetch": {
                    "additionalProperties": {},
                    "properties": {
                      "address": {
                        "type": "string"
                      },
                      "finalUrl": {
                        "type": "string"
                      },
                      "local": {
                        "type": "boolean"
                      },
                      "redirects": {
                        "items": {
                          "type": "string"
                        },
                        "maxItems": 3,
                        "type": "array"
                      },
                      "requestedUrl": {
                        "type": "string"
                      },
                      "status": {
                        "maximum": 9007199254740991,
                        "minimum": -9007199254740991,
                        "type": "integer"
                      }
                    },
                    "required": [
                      "requestedUrl",
                      "finalUrl",
                      "status",
                      "redirects",
                      "address",
                      "local"
                    ],
                    "type": "object"
                  },
                  "kind": {
                    "const": "url",
                    "type": "string"
                  }
                },
                "required": [
                  "kind",
                  "fetch",
                  "content"
                ],
                "type": "object"
              },
              {
                "additionalProperties": {},
                "properties": {
                  "file": {
                    "additionalProperties": {},
                    "properties": {
                      "location": {
                        "enum": [
                          "repo",
                          "external"
                        ],
                        "type": "string"
                      },
                      "name": {
                        "maxLength": 255,
                        "minLength": 1,
                        "type": "string"
                      }
                    },
                    "required": [
                      "name",
                      "location"
                    ],
                    "type": "object"
                  },
                  "image": {
                    "additionalProperties": {},
                    "properties": {
                      "bytes": {
                        "maximum": 9007199254740991,
                        "minimum": 0,
                        "type": "integer"
                      },
                      "height": {
                        "maximum": 9007199254740991,
                        "minimum": 1,
                        "type": "integer"
                      },
                      "mediaType": {
                        "const": "image/webp",
                        "type": "string"
                      },
                      "original": {
                        "additionalProperties": {},
                        "properties": {
                          "bytes": {
                            "maximum": 9007199254740991,
                            "minimum": 0,
                            "type": "integer"
                          },
                          "mediaType": {
                            "enum": [
                              "image/png",
                              "image/jpeg",
                              "image/webp"
                            ],
                            "type": "string"
                          },
                          "sha256": {
                            "pattern": "^[0-9a-f]{64}$",
                            "type": "string"
                          }
                        },
                        "required": [
                          "sha256",
                          "mediaType",
                          "bytes"
                        ],
                        "type": "object"
                      },
                      "path": {
                        "maxLength": 512,
                        "type": "string"
                      },
                      "removedMetadata": {
                        "items": {
                          "enum": [
                            "exif",
                            "gps",
                            "xmp",
                            "iptc",
                            "icc"
                          ],
                          "type": "string"
                        },
                        "type": "array"
                      },
                      "sha256": {
                        "pattern": "^[0-9a-f]{64}$",
                        "type": "string"
                      },
                      "trust": {
                        "const": "untrusted",
                        "type": "string"
                      },
                      "width": {
                        "maximum": 9007199254740991,
                        "minimum": 1,
                        "type": "integer"
                      }
                    },
                    "required": [
                      "path",
                      "sha256",
                      "mediaType",
                      "width",
                      "height",
                      "bytes",
                      "trust",
                      "original",
                      "removedMetadata"
                    ],
                    "type": "object"
                  },
                  "kind": {
                    "const": "image",
                    "type": "string"
                  },
                  "method": {
                    "enum": [
                      "file",
                      "screenshot"
                    ],
                    "type": "string"
                  }
                },
                "required": [
                  "kind",
                  "method",
                  "file",
                  "image"
                ],
                "type": "object"
              },
              {
                "additionalProperties": {},
                "properties": {
                  "content": {
                    "additionalProperties": {},
                    "properties": {
                      "bytes": {
                        "maximum": 9007199254740991,
                        "minimum": 0,
                        "type": "integer"
                      },
                      "mediaType": {
                        "minLength": 1,
                        "type": "string"
                      },
                      "path": {
                        "maxLength": 512,
                        "type": "string"
                      },
                      "sha256": {
                        "pattern": "^[0-9a-f]{64}$",
                        "type": "string"
                      },
                      "trust": {
                        "const": "untrusted",
                        "type": "string"
                      }
                    },
                    "required": [
                      "path",
                      "sha256",
                      "mediaType",
                      "bytes",
                      "trust"
                    ],
                    "type": "object"
                  },
                  "fetch": {
                    "anyOf": [
                      {
                        "additionalProperties": {},
                        "properties": {
                          "address": {
                            "type": "string"
                          },
                          "finalUrl": {
                            "type": "string"
                          },
                          "local": {
                            "type": "boolean"
                          },
                          "redirects": {
                            "items": {
                              "type": "string"
                            },
                            "maxItems": 3,
                            "type": "array"
                          },
                          "requestedUrl": {
                            "type": "string"
                          },
                          "status": {
                            "maximum": 9007199254740991,
                            "minimum": -9007199254740991,
                            "type": "integer"
                          }
                        },
                        "required": [
                          "requestedUrl",
                          "finalUrl",
                          "status",
                          "redirects",
                          "address",
                          "local"
                        ],
                        "type": "object"
                      },
                      {
                        "type": "null"
                      }
                    ]
                  },
                  "file": {
                    "anyOf": [
                      {
                        "additionalProperties": {},
                        "properties": {
                          "location": {
                            "enum": [
                              "repo",
                              "external"
                            ],
                            "type": "string"
                          },
                          "name": {
                            "maxLength": 255,
                            "minLength": 1,
                            "type": "string"
                          }
                        },
                        "required": [
                          "name",
                          "location"
                        ],
                        "type": "object"
                      },
                      {
                        "type": "null"
                      }
                    ]
                  },
                  "kind": {
                    "const": "design-md",
                    "type": "string"
                  }
                },
                "required": [
                  "kind",
                  "fetch",
                  "file",
                  "content"
                ],
                "type": "object"
              }
            ]
          },
          "capturedAt": {
            "pattern": "^\\d{4}-\\d{2}-\\d{2}T\\d{2}:\\d{2}:\\d{2}\\.\\d{3}Z$",
            "type": "string"
          },
          "crops": {
            "items": {
              "additionalProperties": {},
              "properties": {
                "height": {
                  "maximum": 9007199254740991,
                  "minimum": 1,
                  "type": "integer"
                },
                "note": {
                  "maxLength": 500,
                  "minLength": 1,
                  "type": "string"
                },
                "width": {
                  "maximum": 9007199254740991,
                  "minimum": 1,
                  "type": "integer"
                },
                "x": {
                  "maximum": 9007199254740991,
                  "minimum": 0,
                  "type": "integer"
                },
                "y": {
                  "maximum": 9007199254740991,
                  "minimum": 0,
                  "type": "integer"
                }
              },
              "required": [
                "x",
                "y",
                "width",
                "height",
                "note"
              ],
              "type": "object"
            },
            "maxItems": 20,
            "type": "array"
          },
          "doNotCopy": {
            "items": {
              "maxLength": 500,
              "minLength": 1,
              "type": "string"
            },
            "maxItems": 20,
            "minItems": 1,
            "type": "array"
          },
          "id": {
            "pattern": "^REF-[1-9][0-9]{0,5}$",
            "type": "string"
          },
          "influences": {
            "items": {
              "maxLength": 500,
              "minLength": 1,
              "type": "string"
            },
            "maxItems": 20,
            "minItems": 1,
            "type": "array"
          },
          "mode": {
            "enum": [
              "full",
              "reference-only"
            ],
            "type": "string"
          },
          "origin": {
            "maxLength": 2048,
            "minLength": 1,
            "type": "string"
          },
          "reason": {
            "maxLength": 2000,
            "minLength": 1,
            "type": "string"
          },
          "removed": {
            "anyOf": [
              {
                "additionalProperties": {},
                "properties": {
                  "at": {
                    "pattern": "^\\d{4}-\\d{2}-\\d{2}T\\d{2}:\\d{2}:\\d{2}\\.\\d{3}Z$",
                    "type": "string"
                  },
                  "reason": {
                    "type": [
                      "string",
                      "null"
                    ]
                  }
                },
                "required": [
                  "at",
                  "reason"
                ],
                "type": "object"
              },
              {
                "type": "null"
              }
            ]
          },
          "securityFindings": {
            "items": {
              "additionalProperties": {},
              "properties": {
                "code": {
                  "enum": [
                    "SUSPICIOUS_INSTRUCTION",
                    "HIDDEN_TEXT",
                    "METADATA_REMOVED",
                    "LOCAL_TARGET_ALLOWED"
                  ],
                  "type": "string"
                },
                "line": {
                  "anyOf": [
                    {
                      "maximum": 9007199254740991,
                      "minimum": 1,
                      "type": "integer"
                    },
                    {
                      "type": "null"
                    }
                  ]
                },
                "message": {
                  "type": "string"
                },
                "offset": {
                  "anyOf": [
                    {
                      "maximum": 9007199254740991,
                      "minimum": 0,
                      "type": "integer"
                    },
                    {
                      "type": "null"
                    }
                  ]
                },
                "path": {
                  "anyOf": [
                    {
                      "maxLength": 512,
                      "type": "string"
                    },
                    {
                      "type": "null"
                    }
                  ]
                },
                "phrase": {
                  "anyOf": [
                    {
                      "maxLength": 200,
                      "type": "string"
                    },
                    {
                      "type": "null"
                    }
                  ]
                },
                "rule": {
                  "type": [
                    "string",
                    "null"
                  ]
                },
                "severity": {
                  "enum": [
                    "info",
                    "warning"
                  ],
                  "type": "string"
                }
              },
              "required": [
                "code",
                "severity",
                "message",
                "path",
                "offset",
                "line",
                "phrase",
                "rule"
              ],
              "type": "object"
            },
            "type": "array"
          },
          "source": {
            "enum": [
              "manual",
              "url",
              "image",
              "design-md",
              "penpot",
              "refero"
            ],
            "type": "string"
          },
          "studies": {
            "items": {
              "maxLength": 500,
              "minLength": 1,
              "type": "string"
            },
            "maxItems": 20,
            "minItems": 1,
            "type": "array"
          }
        },
        "required": [
          "id",
          "source",
          "origin",
          "capturedAt",
          "mode",
          "reason",
          "studies",
          "doNotCopy",
          "influences",
          "capture",
          "crops",
          "securityFindings",
          "removed"
        ],
        "type": "object"
      },
      "type": "array"
    },
    "schemaVersion": {
      "const": 1,
      "type": "number"
    }
  },
  "required": [
    "kind",
    "schemaVersion",
    "mode",
    "references"
  ],
  "title": "ResearchReferences",
  "type": "object"
}
